	 Absorption (EM radiation)		The process by which the energy of a photon is taken up by matter, typically the electrons of an atom. The electromagnetic energy is transformed to another form of energy, e.g. to heat.	
	 Absorption (physical)		A physical or chemical phenomenon or a process in which atoms, molecules, or ions enter some bulk phase - gas, liquid or solid material. This is a different from Adsorption, since the molecules are taken up by the volume, not by surface.	For example, by absorption of contaminants.
	 Adsorption		"A process that occurs when a gas or liquid solute accumulates on the surface of a solid or a liquid (adsorbent), forming a film of molecules or atoms (the adsorbate). Most industrial adsorbents fall into one of three classes: 1. Oxygen-containing compounds (e.g.silica gel and zeolites 2. Carbon-based compounds (e.g. activated carbon and graphite) 3. Polymer-based compounds 
"	
	 Brazil Nut Effect		A phenomenon in which the largest particles end up on the surface when a granular material containing a mixture of objects of different sizes is shaken. Also known as the muesli effect.	
	 Centrifugal Force		An outward force associated with rotation. Centrifugal force is one of several so-called pseudo-forces (or inertial forces), so named because, unlike real forces, they do not originate in interactions with other bodies situated in the environment of the particle upon which they act. Instead, centrifugal force originates in the rotation of the frame of reference within which observations are made.	By separating the divided solid from contaminants.
	 Combustion		(or burning) A complex sequence of exothermic chemical reactions between a fuel and an oxidant accompanied by the production of heat or both heat and light in the form of either a glow or flames. Direct combustion by atmospheric oxygen is a reaction mediated by radical intermediates typically produced as a result of thermal runaway, where the heat generated by combustion is necessary to maintain the high temperature necessary for radical production.	
	 Convection		The movement of molecules within fluids (i.e. liquids, gases) and rheids. One of the major modes of heat transfer and mass transfer. Convective heat and mass transfer take place through both diffusion (random Brownian motion)  and by advection (transport by the larger-scale motion of currents). Note that a common use of the term convection refers specifically to heat transfer by convection, as opposed to convection in general.	By first dispersing the divided solid in a fluid (liquid or gas).
	 Crystallisation		The (natural or artificial) process of formation of solid crystals precipitating from a identical solution or melt, or more rarely deposited directly from a gas. Crystallisation is also a chemical solid-liquid separation technique, in which mass transfer of a solute from the liquid solution to a pure solid crystalline phase occurs.	
	 Decomposition (biological)		The break down of tissue of a formerly living organism into simpler forms of matter.	
	 Deflagration		A technical term describing subsonic combustion that usually propagates through thermal conductivity (hot burning material heats the next layer of cold material and ignites it). Most 'fire' found in daily life, from flames to explosions, is technically deflagration. Deflagration is different from detonation (which is supersonic and propagates through shock compression).	
	 Density Gradient		Variation of density across an area or through a volume.	
	 Desorption		A phenomenon whereby a substance is released from or through a surface. The process is the opposite of sorption (i.e adsorption and absorption). This occurs in a system being in the state of sorption equilibrium between bulk phase (fluid, i.e. gas or liquid solution) and an adsorbing surface (solid or boundary separating two fluids). When the concentration (or pressure) of substance in the bulk phase is lowered, some of the sorbed substance changes to the bulk state.	
	 Diffusion		The movement of particles from a high concentration to a low concentration.	
	 Eddy Currents		An electrical phenomenon caused when a conductor is exposed to a changing magnetic field due to relative motion of the field source and conductor; or due to variations of the field with time. This can cause eddys of circulating current within the conductor which create electromagnets with magnetic fields that opposes the change of the magnetic field.	For example, electrically conductive particles are slowed when falling though a magnetic field.
	 Enzyme		Proteins that catalyze (i.e., increase the rates of) chemical reactions. Almost all chemical reactions in a biological cell need enzymes in order to occur at rates sufficient for life. Enzymes differ from most other catalysts in that they are highly specific for their substrates	
	 Exothermic Reaction		An exothermic reaction is a chemical reaction accompanied by the release of heat. In other words, the energy needed for the reaction to occur is less than the total energy released. As a result of this, the extra energy is released, usually in the form of heat.	
	 Fermentation		In an industrial context, fermentation refers to the breakdown of organic substances and re-assembly into other substances. Somewhat paradoxically, fermenter culture in industrial capacity often refers to highly oxygenated and aerobic growth conditions, whereas fermentation in the biochemical context is a strictly anaerobic process.	
	 Light		Light is electromagnetic radiation of a wavelength that is visible to the human eye (in a range from about 380 or 400 nanometres to about 760 or 780 nm)	
	 Magnetic Field		A vector field which surrounds magnets and electric currents, and is detected by the force it exerts on moving electric charges and on magnetic materials. When placed in a magnetic field, magnetic dipoles tend to align their axes parallel to the magnetic field. Magnetic fields also have their own energy with an energy density proportional to the square of the field intensity.	
	 Magnetism		One of the phenomena by which materials exert attractive or repulsive forces on other materials. Some well-known materials that exhibit easily detectable magnetic properties (called magnets) are nickel, iron, cobalt, and their alloys; however, all materials are influenced to greater or lesser degree by the presence of a magnetic field.	
	 Ostwald Ripening		An observed phenomenon in solid solutions or liquid sols that describes the change of an inhomogeneous structure over time, i.e., small crystals or sol particles dissolve, and redeposit onto larger crystals or sol particles. Occurs because larger particles are more energetically favored than smaller particles. This stems from the fact that molecules on the surface of a particle are energetically less stable than the ones in the interior. Ostwald ripening is also observed in liquid-liquid systems, causing diffusion of monomers (i.e. individual molecules or atoms) from smaller droplets to larger droplets due to greater solubility of the single monomer molecules in the larger monomer droplets. 	
	 Oxidation		A chemical reaction that involves the loss of electrons or an increase in the oxidation state by a molecule, atom or ion.	
	 Phase Change		The transformation of a thermodynamic system from one phase to another. Most commonly used to describe transitions between solid, liquid and gaseous states of matter, in rare cases including plasma.	
	 Photophoresis		The phenomenon that small particles suspended in gas (aerosols) or liquids (hydrocolloids) starts to migrate when illuminated by a sufficiently intense beam of light. The existence of this phenomenon is owed to a non-uniform distribution of temperature of an illuminated particle in a fluid medium.	By moving particles according to their optical properties, it is possible to separate them from other particles that may have similar aerodynamic properties.
	 Porosity		The quality of being porous - i.e. having voids or spaces within a solid substance within or through which fluids can be present.	
	 Redox Reactions		Redox (shorthand for oxidation-reduction) reactions describe all chemical reactions in which atoms have their oxidation number (oxidation state) changed. This can be either a simple redox process, such as the oxidation of carbon to yield carbon dioxide (CO2) or the reduction of carbon by hydrogen to yield methane (CH4), or a complex process such as the oxidation of sugar(C6H12O6) in the human body through a series of complex electron transfer processes.	
	 Reverse Brazil Nut Effect		Under certain conditions the reverse of the Brazil Nut Effect (granular separation) can occur i.e. following vibration or agitation large beads fall to the bottom of a container, and small beads rising to the top of the container.	
	 Sorption		The action of both absorption and adsorption taking place simultaneously, i.e. the effect of gases or liquids being incorporated into a material of a different state and adhering to the surface of another molecule. Absorption is the incorporation of a substance in one state into another of a different state (e.g., liquids  absorbed by solid or gas absorbed by liquid). Adsorption is the physical adherence or bonding of ions and molecules onto the surface of another molecule.	
	 Sublimation		The change of the physical state of aggregation (or simply state) of matter directly from solid phase to gaseous phase without passing through an intermediate liquid phase.	
	 Superhydrophilicity		Under light irradiation, water dropped onto titanium dioxide forms no contact angle (almost 0 degrees). This effect is called superhydrophilicity. Examples of uses: defogging glass, enabling oil spots to be swept away by water, door mirrors for cars, coatings for buildings, self-cleaning glass, etc. Another use is the property of self-cleaning by the photodecomposition of dirt such as organic compounds adsorbed on the surface.	
	 Thermal Radiation		Electromagnetic radiation emitted from the surface of an object due to the object's temperature.	
	 Thermophoresis		(also called thermodiffusion or Soret Effect) The effect of temperature gradient on multicomponent (or isotopic) mixtures of particles (i.e. particle movement from hotter to colder regions or vice versa). Regarded as 'positive' when molecules move from hot to cold and 'negative' when the reverse is true. Typically the heavier/larger species in a mixture exhibits positive behavior while the lighter/smaller species exhibit negative.	For example, separation by particle size.
	 Acoustic Emission		Transient elastic waves within a material due to localised stress release. Acoustic Emission (AE) events can occur rapidly when materials begin to fail. AE events commonly studied include the extension of a fatigue crack, or fibre breakage in composite materials. AE is related to an irreversible release of energy, and can be generated from sources not involving material failure including friction, cavitation and impact.	
	 Ampère's Circuital Law		Ampère's circuital law relates the integrated magnetic field around a closed loop to the electric current passing through the loop.	
	 Ampère's Force Law		Ampere's Force Law decribes the force of attraction or repulsion between two current-carrying wires.	
	 Auger Effect		When an electron is removed from a core level of an atom, leaving a vacancy, an electron from a higher energy level may fall into the vacancy, resulting in a release of energy. Although sometimes this energy is released in the form of an emitted photon, in the case of the Auger Effect,  the energy is instead transferred to another electron, which is ejected from the atom. 	
	 Barkhausen Effect		Noise in the magnetic output of a ferromagnet when the magnetising force applied to it is changed. It is caused by rapid changes of size of magnetic domains (similarly magnetically oriented atoms in ferromagnetic materials).	
	 Barnett Effect		The magnetisation of a ferromagnetic body when spun on its axis. The magnetisation occurs parallel to the axis of spin.	
	 Bioluminescence		The production and emission of light by a living organism as the result of a chemical reaction 	
	 Biot-Savart Effect		The generation of a magnetic field by a steady current i.e. an unchanging continual flow of charges (for example through a wire).	
	 Bridgman Effect		(or internal Peltier effect) A phenomenon that occurs when an electric current passes through an anisotropic crystal - there is an absorption or liberation of heat because of the non-uniformity in current distribution	
	 Capacitance		The property of a device or material medium to store an electric charge as a result of an electric potential. The most common form of charge storage device is a two-plate capacitor. 	
	 Cathodoluminescence		An optical and electrical phenomenon whereby a beam of electrons is generated by an electron gun (e.g. cathode ray tube) and then impacts on a luminescent material such as a phosphor, causing the material to emit visible light. The most common example is the screen of a television.	
	 Chemiluminescence		The emission of light (luminescence) with limited emission of heat as the result of a chemical reaction. 	
	 Cherenkov Effect		Electromagnetic radiation emitted when a charged particle (such as a electron) passes through an insulator at a speed greater than the speed of light in that medium.	
	 Colloid Vibration Current		An electroacoustic phenomenon that arises when ultrasound propagates through a fluid that contains ions and either solid particles or emulsion droplets.	
	 Compton Scattering		The decrease in energy (increase in wavelength) of an X-ray or gamma ray photon, when it interacts with matter.	
	 Corona Discharge		An electrical discharge brought on by the ionization of a fluid surrounding a conductor, which occurs when the potential gradient (the strength of the electric field) exceeds a certain value, but conditions are insufficient to cause complete electrical breakdown or arcing.	
	 Cyclotron Radiation		Electromagnetic radiation emitted by moving charged particles deflected by a magnetic field. Cyclotron radiation is emitted by all charged particles travelling through magnetic fields, not just those in cyclotrons.	
	 Delta-E Effect		The change in the modulus of elaticity (i.e. Young's Modulus) of a material as a result of magnetisation. Also used to refer to the reverse efect, i.e. the change in magnetism resulting from elastic tension.	
	 Diamagnetism		The property of an object which causes it to create a magnetic field in opposition of an externally applied magnetic field, thus causing a repulsive effect. It is a form of magnetism that is only exhibited by a substance in the presence of an externally applied magnetic field. Diamagnetism is generally a quite weak effect in most materials, although superconductors exhibit a strong effect.	
	 Dorn Effect		(aka Sedimentation Potential). Potential difference resulting from motion of particles through water, typically due to gravity or centrifugation. The motion disrupts equilibrium symmetry of particle's double layer, viscous flow around the particles drags ions of the diffuse layer from them causing slight displacement between surface charge & electric charge of the diffuse layer, giving the particle a dipole moment, generating electric field.	
	 Eddy Currents		An electrical phenomenon caused when a conductor is exposed to a changing magnetic field due to relative motion of the field source and conductor; or due to variations of the field with time. This can cause eddys of circulating current within the conductor which create electromagnets with magnetic fields that opposes the change of the magnetic field.	
	 Electric Arc		An electrical breakdown of a gas which produces an ongoing plasma discharge, resulting from a current flowing through normally nonconductive media such as air	The arc converter (or the arc transmitter or Poulsen arc) is a device used to convert DC energy into RF energy.
	 Electric Sonic Amplitude		Occurs in colloids, emulsions and other heterogeneous fluids under the influence of an oscillating electric field. This field moves particles relative to the liquid, which generates ultrasound.	
	 Electrochemiluminescence		A kind of luminescence produced during electrochemical reactions in solutions. In electrogenerated chemiluminescence, electrochemically generated intermediates undergo a highly exergonic reaction to produce an electronically excited state that then emits light.	
	 Electrohydrodynamics		Includes the following types of particle and fluid transport mechanisms:Electrophoresis, electrokinesis, dielectrophoresis, electro-osmosis, and electrorotation. In general, the phenomena relate to the direct conversion of electrical energy into kinetic energy, and vice versa.	A flow of medium in shaped electrostatic field adds energy to the system which is picked up as a potential difference by electrodes - in effect an electrical generator.
	 Electroluminescence		An optical phenomenon and electrical phenomenon in which a material emits light in response to an electric current passed through it, or to a strong electric field. 	
	 Electromagnetic Induction		The generation of electromotive force (EMF) in a current-carrying conductor exposed to a changing magnetic field	
	 Electrostatic Discharge		The sudden and momentary electric current that flows between two objects at different electrical potentials	For example: light.
	 Electrostatic Induction		A redistribution of electrical charge in an object, caused by the influence of nearby charges. Electrostatic generators, such as the Wimshurst machine, the Van de Graaff generator and the electrophorus, use this principle. Electrostatic induction should not be confused with electromagnetic induction; both are often referred to as 'induction'.	
	 Ettingshausen Effect		(or Second Nernst-Ettingshausen Effect) A thermoelectric (or thermomagnetic) phenomenon that affects electric current in a conductor when a magnetic field is present, resulting in a potential difference is induced normal to both the direction of the magnetic field and the current. Alternately, a temperature gradient is induced. The inverse of the Nernst Effect.	
	 Explosion		A sudden increase in volume and release of energy in an extreme manner, usually with the generation of high temperatures and the release of gases.	
	 Fluorescence		Fluorescence is a luminescence that is mostly found as an optical phenomenon in cold bodies, in which the molecular absorption of a photon triggers the emission of a photon with a longer (less energetic) wavelength. The energy difference between the absorbed and emitted photons ends up as molecular rotations, vibrations or heat. Sometimes the absorbed photon is in the ultraviolet range, and the emitted light is in the visible range.	
	 Fractoluminescence		The emission of light from the fracture (rather than rubbing) of a crystal. Depending upon the atomic and molecular composition of the crystal, when the crystal fractures a charge separation can occur making one side of the fractured crystal +ve charged and the other side -ve charged. As in triboluminescence, if the charge separation results in a large enough electric potential, a discharge across the gap and through the bath gas between the interfaces can occur. 	
	 Garshelis Effect		The effect wherein a circumferentially magnetized rod of ferromagnetic, magnetostrictive material generates a net axial magnetic field in response to an applied torque.	
	 Hall Effect		The potential difference (Hall voltage) on the opposite sides of an electrical conductor through which there is an electric current, created by a magnetic field applied perpendicularly to the current. 	
	 Incandescence		The emission of light (visible electromagnetic radiation) from a hot body due to its temperature.	
	 Induction Heating		The process of heating an electrically conducting object (usually a metal) by electromagnetic induction, where eddy currents are generated within the metal and resistance leads to Joule heating of the metal.	
	 Infrared Radiation		Infrared (IR) radiation is electromagnetic radiation whose wavelength is longer than that of visible light (400-700 nm), but shorter than that of terahertz radiation (3-300 µm) and microwaves (~30,000 µm). Infrared radiation spans roughly three orders of magnitude (750 nm and 1000 µm).	From energy of incident  infrared radiation.
	 Interference		The addition (superposition) of two or more waves that result in a new wave pattern. As most commonly used, the term interference usually refers to the interaction of waves which are correlated or coherent with each other, either because they come from the same source or because they have the same or nearly the same frequency.	
	 Inverse Compton Scattering		The increase in energy (decrease in wavelength) of an X-ray or gamma ray photon, when it interacts with matter.	
	 Inverse Faraday Effect		The effect opposite to the Faraday effect. A static magnetisation is induced by an external oscillating electrical field which can be achieved with a high intensity laser pulse for example	
	 Ion Wind		A stream of ionized fluid generated by a strong electric field (typically a sharp conductive point) exceeding the corona discharge inception voltage gradient, ionizing the air about the tip, creating a small jet of plasma. Ionised air molecules have the same polarity as the charged tip, so are replused as a like-charged ion cloud, that expands due to the repulsion between ions, creating an electric 'wind' and a hissing noise due to pressure change.	
	 Joule Heating		The process by which the passage of an electric current through a conductor releases heat. Heat generated is a function of current, resistance and time. Also known as the Joule-Lenz effect, Ohmic heating or resitive heating.	
	 Latent Heat		Energy released or absorbed, by a body or a thermodynamic system, during a constant-temperature process. An example is a state of matter change, meaning a phase transition, such as ice melting or water boiling.	
	 Lenard Effect		The separation of electric charges accompanying the aerodynamic breakup of water drops. It is also known as spray electrification or the waterfall effect.	
	 Lorentz Force		The force on a point charge due to electromagnetic fields. When a wire carrying an electrical current is placed in a magnetic field, each of the moving charges, which comprise the current, experiences the Lorentz force, and together they can create a macroscopic force on the wire (sometimes called the Laplace force). 	
	 Luminescence		The generation of light that usually occurs at low temperatures, and is thus a form of cold body radiation. It can be caused by chemical reactions, electrical energy, subatomic motions, or stress on a crystal. This distinguishes luminescence from incandescence, which is light generated by high temperatures.	
	 Magnetic Hysteresis		"Hysteresis phenomena occur in magnetic and ferromagnetic materials, as well as in the elastic, electric, and magnetic behavior of materials, in which a lag occurs between the application and the removal of a force or field and its subsequent effect.
Magnetic field hysteresis loss causes heating. This effect is used in induction cooking, where an alternating magnetic field causes a ferrite container to heat directly rather than being heated by an external heat-source."	
	 Magnetoelastic Effects		A group of effects including Magnetostriction (or Joule Magnetostriction), Delta-E Effect, Wiedemann Effect, Magnetovolume Effect, and their Inverses: Villari Effect, Delta-E Effect, Matteucci Effect and the Nagaoka-Honda Effect.	
	 Magnetohydrodynamic Effect		A magnetic field can induce currents in a moving conductive fluid, which create forces on the fluid, and also change the magnetic field itself.	
	 Matteucci Effect		One of a group of Inverse Magnetoelastic Effects.  The creation of a helical anisotropy of the susceptibility of a magnetostrictive material (and e.m.f.) when subjected to a torque.	
	 Mechanoluminescence		Light emission resulting from any mechanical action on a solid. It can be produced through ultrasound, or through other means.	
	 Meissner Effect		(also known as the Jared-Ochsenfeld effect) The expulsion of a magnetic field from a superconductor.	
	 Nagaoka-Honda Effect		One of a group of Magnetoelastic Effects. Change in the magnetic state due to a change in the volume. The inverse of the Magnetovolume Effect.	In the case of a magnetic field.
	 Nernst Effect		The Nernst Effect (or First Nernst-Ettingshausen Effect) is a thermoelectric (or thermomagnetic) phenomenon observed when a sample allowing electrical conduction is subjected to a magnetic field and a temperature gradient normal (perpendicular) to each other. An electric field will be induced normal to both. The inverse is the Ettingshausen Effect (or Second Nernst-Ettingshausen Effect).	
	 Nuclear Fission		The splitting of the nucleus of an atom into parts (lighter nuclei) often producing free neutrons and other smaller nuclei, which may eventually produce photons (in the form of gamma rays). Fission of heavy elements is an exothermic reaction which can release large amounts of energy both as electromagnetic radiation and as kinetic energy of the fragments (heating the bulk material where fission takes place).	
	 Peltier Effect		Heat is evolved or absorbed at the junction of two dissimilar metals carrying a small current, depending upon the direction of the current. One of a number of thermoelectric effects (See Seebeck Effect and Thompson Effect).	In the case of the generation of a thermal field
