	 Terminal Velocity		A free falling object achieves its terminal velocity when the downward force of gravity equals the upward force of drag. This causes the net force on the object to be zero, resulting in an acceleration of zero. Mathematically an object asymptotically approaches and can never reach its terminal velocity.	Where the density of viscosity of a solution is related to its concentration. 
	 Aerodynamic Heating		The heating of a solid body produced by the passage of fluid (such as air) over a body such as a meteor, missile, or airplane. It is a form of forced convection in that the flow field is created by forces beyond those associated with the thermal processes.	The amount of heating can be related to drag.
	 Aeroelastic Flutter		A self-feeding and potentially destructive vibration where aerodynamic forces on an object couple with a structure's natural mode of vibration to produce rapid periodic motion. Flutter can occur in any object within a strong fluid flow, under the conditions that a positive feedback occurs between the structure's natural vibration and the aerodynamic forces. 	The amount of flutter can be related to drag.
	 Electret		An Electret is a dielectric material that has a quasi-permanent electric charge or dipole polarisation. An electret generates internal and external electric fields, and is the electrostatic equivalent of a permanent magnet. 	By attracting impurities to/from the charge on the electret.
	 Vacuum		A volume of space that is essentially empty of matter, such that its gaseous pressure is much less than atmospheric pressure. A perfect vacuum would be one with no particles in it at all, which is impossible to achieve in practice. Physicists often discuss ideal test results that would occur in a perfect vacuum, which they simply call 'vacuum' or 'free space', and use the term partial vacuum to refer to real vacuum.	For example, carrying out processes under vacuum conditions, such as vacuum smelting or refining
	 Fluidisation		A process similar to liquefaction whereby a granular material is converted from a static solid-like state to a dynamic fluid-like state. This process occurs when a fluid (liquid or gas) is passed up through the granular material. When fluidized, a bed of solid particles will behave as a fluid, like a liquid or gas.	Considering the bulk volume of a bed of solid granules.
	 Hyperboloid		A hyperboloid is a quadric, a type of surface in three dimensions. A hyperboloid of revolution of one sheet can be obtained by revolving a hyperbola around its semi-minor axis. A hyperboloid of revolution of two sheets can be obtained by revolving a hyperbola around its focal axis. Hyperboloid structures are used in construction - they can be built with straight steel beams. Examples include cooling towers.	Contrarotation of the ends of a hyperbolic structure will lend to reduce its overall volume.
	 Boiling		A type of phase transition. The rapid vaporisation of a liquid, which typically occurs when a liquid is heated to its boiling point, the temperature at which the vapour pressure of the liquid is equal to the pressure exerted on the liquid by the surrounding environmental pressure.	By reference to a known boiling point.
	 Doppler Effect		The change in frequency and wavelength of a wave for an observer moving relative to the source of the waves. For waves that propagate in a medium, such as sound waves, the velocity of the observer and of the source are relative to the medium in which the waves are transmitted. The total Doppler effect may therefore result from motion of the source, motion of the observer, or motion of the medium.	The estimation of the temperature of a gas which is emitting a spectral line. Due to the thermal motion of the gas, each emitter can be slightly red or blue shifted, and the net effect is a broadening of the line. This line shape is called a Doppler profile and the width of the line is proportional to the square root of the temperature of the gas, allowing the Doppler-broadened line to be used to measure the temperature of the emitting gas.
	 Electrical Resistance		The degree to which an object opposes an electric current flowing through it (usually measured in Ohms). A function of both its physical geometry and the resistivity of the material the object is made from.	Resistance changes with temperature. Near room temperature, the electric resistance of a typical metal varies linearly with the temperature
	 Freezing		A phase change in which a liquid turns into a solid when its temperature is lowered below its freezing point. Colloquially it is applied to water, but technically it applies to any liquid. All known liquids, except liquid helium, freeze when the temperature is lowered enough.	By reference to a known freezing point.
	 Liquid Crystals		Substances that exhibit a phase of matter that has properties between those of a conventional liquid, and those of a solid crystal. 	Liquid Crystal materials can be made which change properties according to temperature.
	 Phase Change		The transformation of a thermodynamic system from one phase to another. Most commonly used to describe transitions between solid, liquid and gaseous states of matter, in rare cases including plasma.	By observing when a substance changes phase.
	 Pyroelectric Effect		The ability of certain materials to generate an electrical potential when they are heated or cooled. As a result of this change in temperature, positive and negative charges move to opposite ends through migration (i.e. the material becomes polarized) and hence, an electrical potential is established.	By measuring the generated electrical potential
	 Radiation		A process in which energetic particles or waves travel through a medium or space. There are two distinct types of radiation; ionizing and non-ionizing. 	The frequency (or wavelength) of emitted radiation can be used as a measure of the temperature of the radiating body
	 Speed of Sound		The distance traveled during a unit of time by a sound wave propagating through an elastic medium. 	The speed of sound in ideal gases is a function of the square root of temperature.
	 Thermochromism		The ability of substance to change color due to a change in temperature. Thermochromism is one of several types of chromism. The two basic approaches are based on liquid crystals and leuco dyes.	The change can be irreversible, providing a permanent visual record of temperature over a surface.
	 Electret		An Electret is a dielectric material that has a quasi-permanent electric charge or dipole polarisation. An electret generates internal and external electric fields, and is the electrostatic equivalent of a permanent magnet. 	Electrets can be used to reduce friction/stiction between surfaces, for example, in a non-contact electrostatic micro-bearing.
	 Superlubricity		A regime of motion in which friction vanishes or very nearly vanishes. Superlubricity may occur when two crystalline surfaces slide over each other in dry incommensurate contact (also called structural lubricity). A state of ultralow friction can also be achieved when a sharp tip slides over a flat surface and the applied load is below a certain threshold. Such 'superlubric' threshold depends on the tip-surface interaction and the stiffness of the materials in contact.	The atoms in graphite are oriented in a hexagonal manner and form an atomic hill-and-valley landscape, which looks like an egg-crate. When the two graphite surfaces are in registry (every 60 degrees), the friction force is high. When the two surfaces are rotated out of registry, the friction is largely reduced. This is like two egg-crates which can slide over each other more easily when they are 'twisted' with respect to each other.
	 Wear		The erosion of material from a solid surface by the action of another surface.	By removal of material in contact.
	 Deformation		A change in the shape or size of an object due to an applied force. This can be a result of tensile (pulling) forces, compressive (pushing) forces, shear, bending or torsion (twisting). Deformation is often described in terms of strain. 	For example, work hardening of metals or alloys.
	 Absorption (EM radiation)		The process by which the energy of a photon is taken up by matter, typically the electrons of an atom. The electromagnetic energy is transformed to another form of energy, e.g. to heat.	If absorbed invisible radiation is subsequently emitted as visible radiation
	 Antibubble		A droplet of liquid surrounded by a thin film of gas, as opposed to a gas bubble, which is a sphere of gas surrounded by a thin film of liquid. Antibubbles are formed when liquid drops or flows turbulently into the same or another liquid. They can either skim across the surface of a liquid such as water (e.g. water globules), or be completely submerged in the liquid to which they are directed.	Antibubbles refract light in a different manner than air bubbles. Because they are water droplets, light entering them is refracted back toward its source in the same manner as rainbows are produced. Because of this refraction, antibubbles have a bright appearance.
	 Conduction (electrical)		The movement of electrically charged particles through a transmission medium (electrical conductor). The movement of charge constitutes an electric current. The charge transport may result as a response to an electric field, or as a result of a concentration gradient in carrier density, that is, by diffusion . 	For example, an incandescent lamp.
	 Focusing		The gathering of wavefronts of a wave (e.g. radiation) into a spherical or cylindical shape. Focusing of light is used in optics, however focusing can be applied to any radiation or wave.	Local increase in brightness using focusing optics (e.g. lens, curved mirror, diffraction grating)
	 Reflection		The change in direction of a wavefront at an interface between two different media so that the wavefront returns into the medium from which it originated. Common examples include the reflection of light, sound and water waves. 	By reflection of incident light.
	 Endothermic Reaction		A process or reaction that absorbs energy typically (but not always) in the form of heat. The concept is frequently applied in physical sciences to e.g. chemical reactions, where thermal energy (heat) is converted to chemical bond energy.	In the case of thermal energy.
	 Hydraulic Jump		When liquid at high velocity discharges into a zone of lower velocity, a rather abrupt rise (a step or standing wave) occurs in the liquid surface. The liquid is abruptly slowed and increases in height converting some of the flow's initial kinetic energy into an increase in potential energy, with some energy lost through turbulence to heat. In an open channel flow, this manifests as the fast flow rapidly slowing and piling up on top of itself.	Example: The hydraulic jump is the most commonly used choice of design engineers for energy dissipation below spillways and outlets. In general it may be used dissipate energy in moving fluids.
	 Phase Change		The transformation of a thermodynamic system from one phase to another. Most commonly used to describe transitions between solid, liquid and gaseous states of matter, in rare cases including plasma.	Phase Changes are exothermic or endothermic.
	 Absorption (EM radiation)		The process by which the energy of a photon is taken up by matter, typically the electrons of an atom. The electromagnetic energy is transformed to another form of energy, e.g. to heat.	On the asumption that whatever incident radiation is not absorbed is reflected.
	 Cavitation		The formation of vapour bubbles in a flowing liquid in a region where the pressure of the liquid falls below its vapour pressure. Usually divided into two classes of behavior. Inertial (or transient) cavitation occurs when a void or bubble in a liquid rapidly collapses, producing a shock wave. Non-inertial cavitation is the process in which a bubble in a fluid is forced to oscillate in size or shape due to energy input, e.g. acoustic field. 	Aggregate density of a liquid is reduced by the presence of cavitation bubbles
	 Physical Containment		Partial or complete enclosure of an object or substance by some physical medium, typically for the purpose of protection or restriction of movement.	If an explanding object is constrained, its density will become fixed once it has reached the limits of a physical container.
	 Compression		The result of the subjection of a material to compressive stress, resulting in reduction of volume. The opposite of compression is tension. In simple terms, compression is a pushing force.	Compressing air raises the dew point may result in condensation of water vapour.
	 Deposition (physical)		A process in which gas transforms into solid (also known as desublimation). The reverse of deposition is sublimation. One example of deposition is the process by which, in sub-freezing air, water vapour changes directly to ice without first becoming a liquid. This is how snow forms in clouds, as well as frost and hoar frost on the ground.	For example: in the case of the formation of snow or frost
	 Gravitational Convection (non heat)		Differential buoyancy forces which cause convection in gravity fields may result from sources of density variations in fluids other than those produced by heat, such as variable composition. For example, diffusion of a source of dry salt downward into wet soil assisted by the mechanism of the fact that saline is heavier than fresh water.	Air density changes with humidity. Convection can cause local changes in humidity.
	 Pressure Increase		Pressure is an effect which occurs when a force is applied on a surface. Pressure is transmitted to solid boundaries or across arbitrary sections of fluid normal to these boundaries or sections at every point.	By promoting condensation of water vapour.
	 Ranque-Hilsch Effect		The Ranque-Hilsch vortex tube (or vortex tube), is a mechanical device that separates a compressed gas into hot and cold streams. It has no moving parts. Pressurised gas is injected tangentially into a swirl chamber and accelerates to a high rate of rotation. Due to the conical nozzle at the end of the tube, only the outer shell of the compressed gas is allowed to escape at that end. The remainder of the gas is forced to return in an inner vortex of reduced diameter within the outer vortex.	In the cold air stream humidy may fall due to condensation or freezing of water vapour.
	 Shock Wave		A type of propagating disturbance. Like an ordinary wave, it carries energy and can propagate through a medium (solid, liquid, gas or plasma) or through a field such as the electromagnetic field. Characterized by an abrupt, nearly discontinuous change in the characteristics of the medium. Associated with rapid rise in pressure, temperature and density of the flow. A shock wave travels through most media at a higher speed than an ordinary wave.	Due to changes in pressure.
	 Electroluminescence		An optical phenomenon and electrical phenomenon in which a material emits light in response to an electric current passed through it, or to a strong electric field. 	By measuring the shape of the area of emitted light and relating it to the shape of the object under test.
	 Reverberation		The persistence of sound in a particular space after the original sound is removed. A reverberation, or reverb, is created when a sound is produced in an enclosed space causing a large number of echoes to build up and then slowly decay as the sound is absorbed by the walls and air.This is most noticeable when the sound source stops but the reflections continue, decreasing in amplitude, until they can no longer be heard.	The shape of a room or other space will influence the nature of reverberations occuring within it.
	 Viscous Heating		The work done by a fluid on adjacent layers due to the action of shear forces is transformed into heat.	For an irreguar body in a fluid flow, viscous heating may depend upon its shape.
	 Electret		An Electret is a dielectric material that has a quasi-permanent electric charge or dipole polarisation. An electret generates internal and external electric fields, and is the electrostatic equivalent of a permanent magnet. 	By attracting material to/from the charge on the electret.
	 Pressurisation		The application of pressure in a given situation or environment; and more specifically refers to the process by which atmospheric pressure is maintained in an isolated or semi-isolated atmospheric environment (for instance, in an aircraft, or whilst scuba diving).	For example, in the case of a disolved gas.
	 Abrasion		The process of scuffing, scratching, wearing down, marring, or rubbing away. It can be intentionally imposed in a controlled process using an abrasive. 	By affecting the surface properties of a conducting surface.
	 Adsorption		"A process that occurs when a gas or liquid solute accumulates on the surface of a solid or a liquid (adsorbent), forming a film of molecules or atoms (the adsorbate). Most industrial adsorbents fall into one of three classes: 1. Oxygen-containing compounds (e.g.silica gel and zeolites 2. Carbon-based compounds (e.g. activated carbon and graphite) 3. Polymer-based compounds 
"	By asorption of a suitable insulating material.
	 Coanda Effect		The tendency of a fluid jet to stay attached to an adjacent suitably shaped curved surface. Also applies to powdered solids.	By encouraging a thermally insulating layer of fluid to cling to a surface.
	 Deposition (physical)		A process in which gas transforms into solid (also known as desublimation). The reverse of deposition is sublimation. One example of deposition is the process by which, in sub-freezing air, water vapour changes directly to ice without first becoming a liquid. This is how snow forms in clouds, as well as frost and hoar frost on the ground.	By deposition of a thermally inslating layer.
	 Freezing		A phase change in which a liquid turns into a solid when its temperature is lowered below its freezing point. Colloquially it is applied to water, but technically it applies to any liquid. All known liquids, except liquid helium, freeze when the temperature is lowered enough.	Convection cannot take polace in a solid material.
	 Negative Thermal Expansion		A physicochemical process in which some materials contract upon heating rather than expanding as most materials do. Materials which undergo this unusual process have a range of potential engineering, photonic, electronic, and structural applications. For example, mixing a negative thermal expansion material with a 'normal' material which expands on heating, could result in a zero expansion composite material.	Shrinking of a material may break a thermal bridge.
	 Bernoulli Effect		For an inviscid flow, an increase in the speed of the fluid occurs simultaneously with a decrease in pressure or a decrease in the fluid's gravitational potential energy	For example, within a fluid flowing horizontally, the highest speed occurs where the pressure is lowest, and the lowest speed occurs where the pressure is highest.
	 Suspension		A heterogeneous fluid containing solid particles that are sufficiently large for sedimentation. Usually they must be larger than 1 micrometer. The internal phase (solid) is dispersed throughout the external phase (fluid - which may be liquid or gas) through mechanical agitation, with the use of certain excipients or suspending agents. 	For example, by creating a suspension of magnetic particles in a liquid.
	 Aerodynamic Heating		The heating of a solid body produced by the passage of fluid (such as air) over a body such as a meteor, missile, or airplane. It is a form of forced convection in that the flow field is created by forces beyond those associated with the thermal processes.	The electrical conductivity of a substance typically changes with temperature.
	 Cooling		The act of reducing temperature.	Typically in metals, for example.
	 Cryogenics		The behavior of materials at very low temperatures (typically below -150 °C, -238 °F or 123 K).	Typically in metals, for example.
	 Electrical Resistance		The degree to which an object opposes an electric current flowing through it (usually measured in Ohms). A function of both its physical geometry and the resistivity of the material the object is made from.	By reducing resistance
	 Fluidisation		A process similar to liquefaction whereby a granular material is converted from a static solid-like state to a dynamic fluid-like state. This process occurs when a fluid (liquid or gas) is passed up through the granular material. When fluidized, a bed of solid particles will behave as a fluid, like a liquid or gas.	For example, a bed of conducting particles fluidised by an insulating liquid or gas.
	 Glassy Carbon		(also called vitreous carbon) A a non-graphitising carbon which combines glassy and ceramic properties with those of graphite. The most important properties are high temperature resistance, extreme resistance to chemical attack and impermeability to gases and liquids. Glassy carbon is widely used as an electrode material in electrochemistry, as well as for high temperature crucibles and as a component of some prosthetic devices.	Glassy carbon has low electrical resistance.
	 Heating		The act of increasing temperature.	For example, in semiconductors, electrical conductivity typically increases with increasing temperature.
	 Lubrication		A process, or technique to reduce wear of one or both surfaces in close proximity, and moving relative to each other, by interposing a substance (lubricant) between the surfaces to carry or to help carry the load (pressure generated) between the opposing surfaces. The interposed lubricant film can be a solid, (e.g. graphite) a solid/liquid dispersion, a liquid, a liquid-liquid dispersion (a grease) or, exceptionally, a gas.	By using a conductive lubricant.
	 Acousto-optic Effect		A specific case of photoelasticity, where there is a change of a material's permittivity due to a mechanical strain resulting from an acoustic wave which has been excited within a transparent medium giving rise to variation of the refractive index. This creates a diffraction grating moving with the velocity given by the spread on the sound wave in the medium which defracts light forming a prominent diffraction pattern. 	By using Bragg cell diffraction implement a scanning spectrometer.
	 Brewster's Angle		Brewster's angle (also known as the polarisation angle) is an angle of incidence at which light with a particular polarisation is perfectly transmitted through a transparent dielectric surface, with no reflection. When unpolarised light is incident at this angle, the light that is reflected from the surface is therefore perfectly polarised.	Since the refractive index for a given medium changes depending on the wavelength of light, Brewster's angle will also vary with wavelength.
	 Doppler Effect		The change in frequency and wavelength of a wave for an observer moving relative to the source of the waves. For waves that propagate in a medium, such as sound waves, the velocity of the observer and of the source are relative to the medium in which the waves are transmitted. The total Doppler effect may therefore result from motion of the source, motion of the observer, or motion of the medium.	A laser Doppler vibrometer (LDV) is a non-contact method for measuring vibration. The laser beam from the LDV is directed at the surface of interest, and the vibration amplitude and frequency are extracted from the Doppler shift of the laser beam frequency due to the motion of the surface.
	 Focusing		The gathering of wavefronts of a wave (e.g. radiation) into a spherical or cylindical shape. Focusing of light is used in optics, however focusing can be applied to any radiation or wave.	Focus distance is dependent on frequency of the radiation being focussed.
	 Hall Effect		The potential difference (Hall voltage) on the opposite sides of an electrical conductor through which there is an electric current, created by a magnetic field applied perpendicularly to the current. 	Hall sensors are used to time the speed of wheels and shafts, such as for internal combustion engine ignition timing or tachometers.
	 Interference		The addition (superposition) of two or more waves that result in a new wave pattern. As most commonly used, the term interference usually refers to the interaction of waves which are correlated or coherent with each other, either because they come from the same source or because they have the same or nearly the same frequency.	For example, checking the tuning of a musical instrument using interference beats.
	 Negative Refraction		An electromagnetic phenomenon where light rays are refracted at an interface in the reverse sense to that normally expected. Negative refraction occurs at interfaces between materials at which one has an ordinary positive phase velocity (i.e. a positive refractive index), and the other has the more exotic negative phase velocity (refractive index).	Refraction is related to frequency.
	 Refraction		The change in direction of a wave due to a change in its speed. This is most commonly observed when a wave passes from one medium to another at any angle other than 90° or 0°. Refraction of light is the most commonly observed phenomenon, but any type of wave can refract when it interacts with a medium, for example when sound waves pass from one medium into another or when water waves move into water of a different depth. 	Refraction is related to frequency.
