	 Ruled Surface		A surface S is ruled if through every point of S there is a straight line that lies on S. The most familiar examples are the plane and the curved surface of a cylinder or cone. A ruled surface can always be described (at least locally) as the set of points swept by a moving straight line. For example, a cone is formed by keeping one end-point of a line fixed whilst moving the other end-point in a circle.	
	 Shape Memory Alloy		An alloy that 'remembers' its original, cold-forged shape: returning the pre-deformed shape by heating. This material is a lightweight, solid-state alternative to conventional actuators such as hydraulic, pneumatic, and motor-based systems. 	
	 Surface of Constant Width		A convex form whose width, measured by the distance between two opposite parallel planes touching its boundary, is the same regardless of the direction of those two parallel planes. The three-dimensional analogue of a curve of constant width, a two-dimensional shape with a constant distance between pairs of parallel tangent lines. A sphere is obviously a surface of constant width, but there are others, such as Meissner Bodies.	By acting as a rolling support (e.g. a ball bearing - but note that non-spherical shapes are possible)
	 Angle of Repose		(or critical angle of repose) The minimum angle made by the inclined plane with the horizontal surface such that the body lying on the inclined plane is just at the verge of sliding down along the inclined plane. When bulk granular materials are poured onto a horizontal surface, a conical pile will form. The internal angle between the surface of the pile and the horizontal surface is known as the angle of repose and is related to the density, surface area and shapes of the particles, and the coefficient of friction of the material. 	For example, piles of granular material.
	 Electric Arc		An electrical breakdown of a gas which produces an ongoing plasma discharge, resulting from a current flowing through normally nonconductive media such as air	If the divided solid carries an electric charge.
	 Ostwald Ripening		An observed phenomenon in solid solutions or liquid sols that describes the change of an inhomogeneous structure over time, i.e., small crystals or sol particles dissolve, and redeposit onto larger crystals or sol particles. Occurs because larger particles are more energetically favored than smaller particles. This stems from the fact that molecules on the surface of a particle are energetically less stable than the ones in the interior. Ostwald ripening is also observed in liquid-liquid systems, causing diffusion of monomers (i.e. individual molecules or atoms) from smaller droplets to larger droplets due to greater solubility of the single monomer molecules in the larger monomer droplets. 	Example: the re-crystallization of water within ice cream which gives old ice cream a gritty, crunchy texture. Larger ice crystals grow at the expense of smaller ones within the ice cream, creating a coarser texture.
	 Aggregated Diamond Nanorod		(or ADNRs or hyperdiamond) A nanocrystalline form of diamond believed to be the hardest and least compressible known material, as measured by its isothermal bulk modulus	
	 Eddy Currents		An electrical phenomenon caused when a conductor is exposed to a changing magnetic field due to relative motion of the field source and conductor; or due to variations of the field with time. This can cause eddys of circulating current within the conductor which create electromagnets with magnetic fields that opposes the change of the magnetic field.	Through inductive heating
	 Bernoulli Effect		For an inviscid flow, an increase in the speed of the fluid occurs simultaneously with a decrease in pressure or a decrease in the fluid's gravitational potential energy	When combined with a system to convert pressure changes into rotary motion, such as a hinged aerofoil or turbine.
	 Eddy Currents		An electrical phenomenon caused when a conductor is exposed to a changing magnetic field due to relative motion of the field source and conductor; or due to variations of the field with time. This can cause eddys of circulating current within the conductor which create electromagnets with magnetic fields that opposes the change of the magnetic field.	For example an eddy current speedometer.
	 Electromagnetic Induction		The generation of electromotive force (EMF) in a current-carrying conductor exposed to a changing magnetic field	For example an eddy current speedometer.
	 Hyperboloid		A hyperboloid is a quadric, a type of surface in three dimensions. A hyperboloid of revolution of one sheet can be obtained by revolving a hyperbola around its semi-minor axis. A hyperboloid of revolution of two sheets can be obtained by revolving a hyperbola around its focal axis. Hyperboloid structures are used in construction - they can be built with straight steel beams. Examples include cooling towers.	Hyperboloid forms are sometimes used for transmission gears.
	 Magnetic Reluctance		Analogous to the way an electric field causes an electric current to follow the path of least resistance, a magnetic field causes magnetic flux to follow the path of least magnetic reluctance.	Variation of reluctance is the principle behind the reluctance motor. Reluctance forces strive for a maximally aligned magnetic circuit and a minimal air gap distance.
	 Meissner Body		A surface of constant width constructed by replacing three of the edge arcs of a Reuleaux tetrahedron by curved patches formed as the surfaces of rotation of a circular arc. It has been conjectured (but not yet proved) that Meissner Bodies are the minimum-volume three-dimensional shapes of constant width.	
	 Möbius Strip		A surface with only one side and only one boundary component.	
	 Spheroid		A quadric surface obtained by rotating an ellipse about one of its principal axes; in other words, an ellipsoid with two equal semi-diameters. If the ellipse is rotated about its major axis, the result is a prolate (elongated) spheroid, somewhat similar to a rugby ball. If the ellipse is rotated about its minor axis, the result is an oblate (flattened) spheroid, somewhat similar to a lentil. If the generating ellipse is a circle, the surface is a sphere.	
	 Stokes Drift		The movement of a specific fluid parcel as it travels with the fluid flow due to wave motion.	For a solid floating in a liquid.
	 Creep		The tendency of a solid material to slowly move or deform permanently under the influence of stresses. A result of long term exposure to levels of stress that are below the yield strength of the material. Creep is more severe in materials that are subjected to heat for long periods, and near the melting point. Creep always increases with temperature. The rate of deformation is a function of the material properties, exposure time, exposure temperature and the applied structural load.	
	 Deformation		A change in the shape or size of an object due to an applied force. This can be a result of tensile (pulling) forces, compressive (pushing) forces, shear, bending or torsion (twisting). Deformation is often described in terms of strain. 	Particulalrly in the case of solid structures.
	 Deposition (physical)		A process in which gas transforms into solid (also known as desublimation). The reverse of deposition is sublimation. One example of deposition is the process by which, in sub-freezing air, water vapour changes directly to ice without first becoming a liquid. This is how snow forms in clouds, as well as frost and hoar frost on the ground.	If preceeded by, for example, sublimation of the solid.
	 Elastic Recovery		The tendancy of a material that has been stretched to return to its original shape.	For example, through the use of an elastic band or sheet.
	 Brownian Motion		The random movement of particles suspended in a liquid or gas	In the case of a liquid particles in an aerosol. 
	 Cooling		The act of reducing temperature.	In the case of liquids that exhibit negative thermal expansion - such as watrer close to its freezing point.
	 Eddy Currents		An electrical phenomenon caused when a conductor is exposed to a changing magnetic field due to relative motion of the field source and conductor; or due to variations of the field with time. This can cause eddys of circulating current within the conductor which create electromagnets with magnetic fields that opposes the change of the magnetic field.	Through eddy current heating.
	 Elastic Recovery		The tendancy of a material that has been stretched to return to its original shape.	For example, if enclosed in a vessel having a larger original shape.
	 Friction		The force resisting the relative motion of two surfaces in contact or a surface in contact with a fluid (e.g. air on an aircraft or water in a pipe).	As a result of heat generation.
	 Gravitation		A natural phenomenon by which objects with mass attract one another. In everyday life, gravitation is most commonly thought of as the agency which lends weight to objects with mass.	For example, using a piston tensioned by gravity.
	 Magnetocaloric Effect		(or Magnetothermal Effect) A magneto-thermodynamic phenomenon in which a reversible change in temperature of a suitable material is caused by exposing the material to a changing magnetic field. Also known as adiabatic demagnetisation. Can be used to attain extremely low temperatures (well below 1 K), as well as the ranges used in common refrigerators.	As a result of the temperature increase.
	 Magnetostriction		A property of ferromagnetic materials that causes them to change their shape or dimensions during the process of magnetisation. The variation of material's magnetisation due to the applied magnetic field changes the magnetostrictive strain until reaching its saturation value. This effect can cause losses due to frictional heating in susceptible ferromagnetic cores.	Indirectly, e.g. by a piston rod subject to Magnetostriction.
	 Magnetovolume Effect		One of a group of Magnetoelastic Effects. Volume change due to magnetisation (most evident near the Curie temperature)	Indirectly, e.g. by a piston rod subject to the Magnetovolume Effect.
	 Marangoni Effect		(or Gibbs-Marangoni effect)  The presence of a gradient in surface tension will naturally cause the liquid to flow away from regions of low surface tension. The surface tension gradient can be caused by concentration gradient or by a temperature gradient (surface tension is a function of temperature).	
	 Tension		The pulling force exerted by a string, cable, chain, or similar object on another object. It is the opposite of compression.	Indirectly, for example, using a piston.
	 Thermal Contraction		The tendency of matter to reduce in volume (contract)  in response to a change in temperature or when a substance is cooled.	Indirectly, e.g. using thermal contraction of a piston rod.
	 Vapour Pressure		The pressure of a vapor in thermodynamic equilibrium with its condensed phases in a closed system. All liquids and solids have a tendency to evaporate into a gaseous form, and all gases have a tendency to condense back to their liquid or solid form.	Through conversion to gas.
	 Dielectric		An electrical insulator that can be polarized by an applied electric field.Can be used for the storage and dissipation of electric and magnetic energy. 	
	 Reflection		The change in direction of a wavefront at an interface between two different media so that the wavefront returns into the medium from which it originated. Common examples include the reflection of light, sound and water waves. 	For example, in the case of light focussed by concave mirror.
	 Archimedes' Principle (Buoyancy)		The upward force on an object produced by the surrounding liquid or gas in which it is fully or partially immersed, due to the pressure difference of the fluid between the top and bottom of the object. The net upward buoyancy force is equal to the magnitude of the weight of fluid displaced by the body. This force enables the object to float or at least to seem lighter.	For example a density column can be used to separate a series of immiscible gases of different density.
	 Effusion		The process where individual molecules flow through a hole without collisions between molecules. This occurs if the diameter of the hole is considerably smaller than the mean free path of the molecules.	For example, a balloon filled with low molecular weight hydrogen left alone for a reasonable amount of time deflates faster than a separate balloon full of higher molecular weight oxygen. Effusion is used in the production of enriched uranium by gaseous diffusion.
	 Electrostatics		The phenomena arising from stationary or slowly moving electric charges	In the case of a charged gas.
	 Electrolysis		A method of separating chemically bonded elements and compounds by passing an electric current through them. Electrolysis involves the passage of an electric current through an ionic substance that is either molten or dissolved in a suitable solvent, resulting in chemical reactions at the electrodes. 	Through electrolytic deposition at electrodes.
	 Evaporation		The change of the physical state of aggregation (or simply state) of matter from  liquid phase to gaseous phase. 	For example, evaporation is a common method of thin film deposition. The source material is evaporated in a vacuum. The vacuum allows vapour particles to travel directly to the target object (substrate), where they condense back to a solid state.
	 Fluidisation		A process similar to liquefaction whereby a granular material is converted from a static solid-like state to a dynamic fluid-like state. This process occurs when a fluid (liquid or gas) is passed up through the granular material. When fluidized, a bed of solid particles will behave as a fluid, like a liquid or gas.	Fluidisation allows granular solid material to be manipulated as if it were a liquid, allowing liquid processing methods to be used, such as pumping.
	 Lotus Leaf Effect		The leaves of the sacred lotus flower (Nelumbo) are characterized by a very high water repellency (superhydrophobicity). Dirt particles are picked up by water droplets due to a complex micro- and nanoscopic architecture of the surface which enables minimisation of adhesion.	Particles of dirt on a surface can be accumulated on the surface of water droplets running over the surface.
	 Supercritical Fluid		Any substance at a temperature and pressure above its critical point. It can diffuse through solids like a gas, and dissolve materials like a liquid. Additionally, close to the critical point, small changes in pressure or temperature result in large changes in density, allowing many properties to be 'tuned'.	Supercritical fluids can be used to deposit functional nanostructured films and nanometer-size particles of metals onto surfaces. The gas-like surface tension, diffusivities, and viscosities allows access to nano pores much smaller than can be accessed by liquids The liquid-like solubilities allow much higher precursor concentrations than are typical in chemical vapour deposition.
	 Light		Light is electromagnetic radiation of a wavelength that is visible to the human eye (in a range from about 380 or 400 nanometres to about 760 or 780 nm)	For example, using a high-power laser source.
	 Magnetoelastic Effects		A group of effects including Magnetostriction (or Joule Magnetostriction), Delta-E Effect, Wiedemann Effect, Magnetovolume Effect, and their Inverses: Villari Effect, Delta-E Effect, Matteucci Effect and the Nagaoka-Honda Effect.	Through heating resulting from collapse of cavitation bubbles resulting from the manetostriction effect on a magnetic liquid.
	 Magnetostriction		A property of ferromagnetic materials that causes them to change their shape or dimensions during the process of magnetisation. The variation of material's magnetisation due to the applied magnetic field changes the magnetostrictive strain until reaching its saturation value. This effect can cause losses due to frictional heating in susceptible ferromagnetic cores.	Through heating resulting from collapse of cavitation bubbles resulting from the manetostriction effect on a magnetic liquid.
	 Peltier Effect		Heat is evolved or absorbed at the junction of two dissimilar metals carrying a small current, depending upon the direction of the current. One of a number of thermoelectric effects (See Seebeck Effect and Thompson Effect).	Through heating of the liquid
	 Suction		The flow of a fluid into a partial vacuum, or region of low pressure. The pressure gradient between this region and the ambient pressure will propel matter toward the low pressure area. 	Low pressure may cause a liquied to boil/evaporate
	 Supercritical Fluid		Any substance at a temperature and pressure above its critical point. It can diffuse through solids like a gas, and dissolve materials like a liquid. Additionally, close to the critical point, small changes in pressure or temperature result in large changes in density, allowing many properties to be 'tuned'.	A supercritical fulid has many of the properties of a gas.
	 Surface Tension		An attractive property of the surface of a liquid. It is what causes the surface portion of liquid to be attracted to another surface, such as that of another portion of liquid (as in connecting bits of water or as in a drop of mercury that forms a cohesive ball).	The vapour pressure for small droplets of liquid in suspension is greater than standard vapour pressure of that same liquid when the interface is flat.
	 Ultrasonic Vibration		Vibration at ultrasonic frequencies.	Ultrasonic vibration can be used to speed evaporation of liquids.
	 Adsorption		"A process that occurs when a gas or liquid solute accumulates on the surface of a solid or a liquid (adsorbent), forming a film of molecules or atoms (the adsorbate). Most industrial adsorbents fall into one of three classes: 1. Oxygen-containing compounds (e.g.silica gel and zeolites 2. Carbon-based compounds (e.g. activated carbon and graphite) 3. Polymer-based compounds 
"	Following the adsorption of a material on the surface of an adsorbent.
	 Elastic Recovery		The tendancy of a material that has been stretched to return to its original shape.	For example, through the use of an elastic band.
	 Elasticity		The physical property of a material when it deforms under stress (e.g. external forces), but returns to its original shape when the stress is removed. The amount of deformation is called the strain. The elastic regime is characterized by a linear relationship between stress and strain, denoted linear elasticity. 	E.g. an elastic band
	 Electrostatic Induction		A redistribution of electrical charge in an object, caused by the influence of nearby charges. Electrostatic generators, such as the Wimshurst machine, the Van de Graaff generator and the electrophorus, use this principle. Electrostatic induction should not be confused with electromagnetic induction; both are often referred to as 'induction'.	The presence of a charged object will induce charge differerences in other nearby objects that may be exploited to generate attractive or repulsive forces.
	 Melting		A process that results in the phase change of a substance from a solid to a liquid. The internal energy of a solid substance is increased (typically by the absorbtion of heat) to a specific temperature (called the melting point) at which it changes to the liquid phase. 	By transient liquid phase bonding - i.e. melting a solid material as using it as 'glue', joining two solids after it has cooled and resolidified.
	 Surface Tension		An attractive property of the surface of a liquid. It is what causes the surface portion of liquid to be attracted to another surface, such as that of another portion of liquid (as in connecting bits of water or as in a drop of mercury that forms a cohesive ball).	For example, it is possible to suapend a suitable solid on the surface of water by surface tension.
	 Thermal Expansion		The tendency of matter to change in volume in response to a change in temperature or when a substance is heated.	For example by using the expansion of a solid in a limited space to result in it becoming jammed in place.
	 Vacuum		A volume of space that is essentially empty of matter, such that its gaseous pressure is much less than atmospheric pressure. A perfect vacuum would be one with no particles in it at all, which is impossible to achieve in practice. Physicists often discuss ideal test results that would occur in a perfect vacuum, which they simply call 'vacuum' or 'free space', and use the term partial vacuum to refer to real vacuum.	For example: Magdeburg hemispheres
	 Aerodynamic Heating		The heating of a solid body produced by the passage of fluid (such as air) over a body such as a meteor, missile, or airplane. It is a form of forced convection in that the flow field is created by forces beyond those associated with the thermal processes.	Though heating of the solid.
	 Brownian Motion		The random movement of particles suspended in a liquid or gas	In the sense that particles of a solid become more widely distributed as a result of Brownian Motion.
	 Cooling		The act of reducing temperature.	In the case of solids that exhibit negative thermal expansion.
	 Eddy Currents		An electrical phenomenon caused when a conductor is exposed to a changing magnetic field due to relative motion of the field source and conductor; or due to variations of the field with time. This can cause eddys of circulating current within the conductor which create electromagnets with magnetic fields that opposes the change of the magnetic field.	Through eddy current heating of the solid.
	 Elastic Recovery		The tendancy of a material that has been stretched to return to its original shape.	For example, if connected to another solid experiencing elastic recovery.
	 Gravitation		A natural phenomenon by which objects with mass attract one another. In everyday life, gravitation is most commonly thought of as the agency which lends weight to objects with mass.	For example, suspending a solid object in a gravity field will cause it to stretch.
	 Inertia		The resistance of any physical object to a change in its state of motion or rest. It is proportional to an object's mass. 	Applying instantaneous tension to one side of an object will (initially) cause it to be stretched due to the intertia of the object.
	 Abrasion		The process of scuffing, scratching, wearing down, marring, or rubbing away. It can be intentionally imposed in a controlled process using an abrasive. 	Through friction heating
	 Stroboscopic Effect		A visual phenomenon caused by aliasing that occurs when continuous motion is represented by a series of short or instantaneous samples. It occurs when the view of a moving object is represented by a series of short samples as distinct from a continuous view, and the moving object is in rotational or other cyclic motion at a rate close to the sampling rate.	
	 Abrasion		The process of scuffing, scratching, wearing down, marring, or rubbing away. It can be intentionally imposed in a controlled process using an abrasive. 	By reducing particle size.
	 Ultrasonic Vibration		Vibration at ultrasonic frequencies.	Through settling.
	 Vibration		Mechanical oscillations about an equilibrium point. The oscillations may be periodic such as the motion of a pendulum or random such as the movement of a tire on a gravel road.	Through settling.
	 Wear		The erosion of material from a solid surface by the action of another surface.	Through closer packing of finder particles.
	 Adsorption		"A process that occurs when a gas or liquid solute accumulates on the surface of a solid or a liquid (adsorbent), forming a film of molecules or atoms (the adsorbate). Most industrial adsorbents fall into one of three classes: 1. Oxygen-containing compounds (e.g.silica gel and zeolites 2. Carbon-based compounds (e.g. activated carbon and graphite) 3. Polymer-based compounds 
"	By adsorbing surface contaminants onto an adsorbent material. For example, wiping a surface with a cloth or sponge to remove dirt.
	 Archimedes' Principle (Buoyancy)		The upward force on an object produced by the surrounding liquid or gas in which it is fully or partially immersed, due to the pressure difference of the fluid between the top and bottom of the object. The net upward buoyancy force is equal to the magnitude of the weight of fluid displaced by the body. This force enables the object to float or at least to seem lighter.	A mixture of two solids having different densities can be separated by dropping them into a vessel containing a liquid having a density between that of the two solids.
	 Brazil Nut Effect		A phenomenon in which the largest particles end up on the surface when a granular material containing a mixture of objects of different sizes is shaken. Also known as the muesli effect.	Can be used to sort particles by size and/or shape.
	 Cheerio Effect		The tendency for small wettable floating objects to attract one another as a result of a combination of surface tension and buoyancy.	Clumping of solid particles facilitates their separation from a liquid or from particles of different buoyancy or surface tension
	 Eddy Currents		An electrical phenomenon caused when a conductor is exposed to a changing magnetic field due to relative motion of the field source and conductor; or due to variations of the field with time. This can cause eddys of circulating current within the conductor which create electromagnets with magnetic fields that opposes the change of the magnetic field.	Eddy Currents can be used to induce a magnetic field in aluminium cans, which allows them to be separated easily from other recyclables.
