	 Injector		(or ejector) A pump-like device that uses the Venturi effect of a converging-diverging nozzle to convert pressure energy of a motive fluid to velocity energy, creating a low pressure zone that draws in and entrains a suction fluid. After passing through the throat of the injector, the mixed fluid expands and the velocity reduced, recompressing the mixed fluids by converting velocity energy back to pressure energy.	
	 Magnetic Shape Memory		Magnetic shape memory (MSM) alloys, or ferromagnetic shape memory alloys (FSMA), are ferromagnetic materials exhibiting large changes in shape and size under the influence of an applied magnetic field due to martensitic phase transformation.	Indirectly, e.g. by a piston rod made from a magnetic shape memory material.
	 Peristaltic Pump		A type of positive displacement pump used for pumping a variety of fluids.	
	 Surfactant		Wetting agents that lower the surface tension of a liquid, allowing easier spreading, and lower the interfacial tension between two liquids. Surfactants may act as: detergents, wetting agents, emulsifiers, foaming agents, and dispersants.	In the sense that the liquid can be spread over a larger area.
	 Weightlessness		(or zero-g) is any condition equivalent to experiencing little or no acceleration or gravitational attraction, e.g., far from a planet, star, or other massive body, flying an outside loop.  From the equivalence principle for acceleration and gravitational attraction it follows that weightlessness can also be experienced in free fall, which is the cause of weightlessness of objects in orbit about the Earth. 	Objects normally compressed by their own weight expand under weightless conditions.
	 Alternating Magnetic Field		Low frequency alternating magnetic fields can increase the hardness of some materials. They can also be used to induce eddy currents - which can give rise to a repulsive magnetic field.	
	 Carbon Nanotubes		Allotropes of carbon with a nanostructure that can have a length-to-diameter ratio greater than 1,000,000.  They exhibit extraordinary strength and unique electrical properties, and are efficient conductors of heat. 	Semiconducting single-walled carbon nanotubes emit near-infrared light upon photoexcitation
	 Electromethanogenesis		Electromethanogenesis is a form of electrofuel production where methane is produced by direct biological conversion from electrical current and carbon dioxide	
	 Flow Battery		A form of rechargeable battery in which electrolyte containing one or more dissolved electroactive species flows through a power cell / reactor that converts chemical energy to electricity. Additional electrolyte is stored externally and typically pumped through the cell(s) of the reactor. Can be rapidly 'recharged' by replacing the electrolyte (analogous to refilling a fuel tank) while  recovering the spent material for re-energisation.	
	 Fuel Cell		"An electrochemical conversion device. It produces electricity from fuel (on the anode side) and an oxidant (on the cathode side), which react in the presence of an electrolyte. The reactants flow into the cell, and the reaction products flow out of it, while the electrolyte remains within it. Fuel cells can operate virtually continuously as long as the necessary flows are maintained.
"	
	 Light Emitting Diode		A semiconductor diode that emits light when an electric current is applied in the forward direction of the device, as in the simple LED circuit. The effect is a form of electroluminescence where incoherent and narrow-spectrum light is emitted from the p-n junction in a solid state material.	
	 Maglev		(magnetic levitation)  A system of transportation that suspends, guides and (usually) propels vehicles, predominantly trains, using magnetic forces.	
	 Magnetic Amplifier		An electromagnetic device for amplifying electrical signals. It makes use of magnetic saturation of the core, a non-linear property of a certain class of transformer cores. It is a static device with no moving parts, no wear-out mechanism and has a good tolerance to mechanical shock and vibration. It requires no warm-up time.	
	 Maser		A device that produces coherent electromagnetic waves through amplification by stimulated emission. A laser is an optical maser.	
	 Microbial Fuel Cell		A microbial fuel cell (MFC) or biological fuel cell is a bio-electrochemical system that drives a current by mimicking bacterial interactions found in nature.	
	 Organic Light-emitting Diode		(or Light Emitting Polymer (LEP) or Organic Electro Luminescence (OEL)) A Light Emitting Diode (LED) whose emissive electroluminescent layer is composed of a film of organic compounds. The layer usually contains a polymer substance that allows suitable organic compounds to be deposited. They are deposited in rows and columns onto a flat carrier by a simple 'printing' process. The resulting matrix of pixels can emit light of different colors.	
	 Phosphor Thermometry		An optical method for surface temperature measurement. The method exploits luminescence emitted by phosphor material. Phosphors are fine white or pastel-colored inorganic powders which may be stimulated by any of a variety of means to luminesce, i.e. emit light. Certain characteristics of the emitted light change with temperature, including brightness, color, and afterglow duration. The latter is most commonly used for temperature measurement.	
	 Rectenna		A special type of antenna that is used to convert electromagnetic energy into direct current electricity	
	 Thermopile		An electronic device that converts thermal energy into electrical energy. It is composed of several thermocouples connected usually in series or, less commonly, in parallel.	Electrical energy from a thermal difference.
	 Thin Films		Thin material layers ranging from fractions of a nanometre to several micrometres in thickness. Electronic semiconductor devices and optical coatings are the main applications benefiting from thin film construction.	Thin-film printing technology is being used to apply solid-state lithium polymers to a variety of substrates to create unique batteries for specialized applications. Thin-film batteries can be deposited directly onto chips or chip packages in any shape or size. Flexible batteries can be made by printing onto plastic, thin metal foil, or paper
	 Tritium		A radioactive isotope of hydrogen. The nucleus of tritium contains one proton and two neutrons, whereas the nucleus of protium (by far the most abundant hydrogen isotope) contains one proton and no neutrons. Tritium decays into helium-3 by beta decay.	
	 Voitenko Compressor		A shaped charge adapted from its original purpose of piercing thick steel armour to the task of accelerating shock waves. It slightly resembles a wind tunnel.	
	 Anisotropy		The property of being directionally dependent. It can be defined as a difference in a physical property (absorbance, refractive index, density, etc.) for some material when measured along different axes. An example is the light coming through a polarising lens.	For example, liquid crystals
	 Arch		A curved structure that spans a space while supporting weight. It provides a structure which eliminates tensile stresses in spanning an open space. All the forces are resolved into compressive stresses. 	Direction of force or a mechanical  field is partially redirected
	 Fresnel Lens		A lens using less material compared to a conventional spherical lens by breaking the lens into a set of concentric annular sections. For each of these, the overall thickness of the lens is decreased, breaking the continuous surface of a standard lens into a set of surfaces of the same curvature, with discontinuities between them. This reduces the thickness (and weight and volume) of the lens, at the expense of reducing the imaging quality.	
	 Misznay-Schardin Effect		A characteristic of the detonation of a broad sheet of explosive. The explosive blast expands directly away from (perpendicular to) the surface of an explosive (unlike the blast from a rounded explosive charge)	
	 Optical Fibre		A fibre (typically made of glass or plastic) that carries light along its length	
	 Photoelasticity		A method used to determine the stress distribution in a material based upon changes in birefringence resulting from stress.	The plane of polarisation rotates due to the stress in the material.
	 Photon Sieve		A device for focusing light using diffraction and interference. It consists of a flat sheet of material full of pinholes that are arranged in a pattern which is similar to the rings in a Fresnel zone plate, but a sieve brings light to much sharper focus than a zone plate.	
	 Prism		A transparent optical element with flat, polished surfaces that refract light. The exact angles between the surfaces depend on the application. The traditional geometrical shape is that of a triangular prism with a triangular base and rectangular sides, and in colloquial use 'prism' usually refers to this type.	
	 Thin Films		Thin material layers ranging from fractions of a nanometre to several micrometres in thickness. Electronic semiconductor devices and optical coatings are the main applications benefiting from thin film construction.	A familiar application of thin films is the household mirror, which typically has a thin metal coating on the back of a sheet of glass to form a reflective interface.
	 Waveguide		A structure which guides waves, such as electromagnetic waves or sound waves. There are different types of waveguide for each type of wave: electromagnetic, optical or acoustic.	
	 Waveguide (optics)		Waveguides used at optical frequencies are typically dielectric waveguides, structures in which a dielectric material with high permittivity, and thus high index of refraction, is surrounded by a material with lower permittivity. The structure guides optical waves by total internal reflection. The most common optical waveguide is optical fibre.	
	 Zone Plate		A device used to focus electromagnetic ratiation (including light), using diffraction instead of refraction. It consists of a set of radially symmetric rings which alternate between opaque and transparent. Incident radiation diffracts around the opaque zones which can be spaced so that the diffracted radiation constructively interferes at a desired focus, creating an image there.	
	 Archimedes Screw		A device with a revolving screw-shaped blade inside a cylinder that can be used for pumping liquids and semifluid solids such as coal and grain.	
	 Brownian Motor		A nano-scale or molecular device by which thermally activated processes (chemical reactions) are controlled and used to generate directed motion in space and to do mechanical or electrical work. Because this type of motor is so strongly dependent on random thermal noise, Brownian motors are feasible only at the nanometer scale.	
	 Foil (fluid mechanics)		A surface designed to maximize lift (force generated perpendicular to the fluid flow) while minimizing drag (force generated in the direction of the fluid flow) in a given range of conditions. Foils may be designed to operate in any fluid, such as air or water.	In the case of a divided solid suspended in a fluid (liquid or gas).
	 Oloid		A three-dimensional solid formed by taking the convex hull of the shape made by intersecting two disks of equal radius at right angles within one another, with the distance between the centers of the disks equal to their radius. The only known object other than some members of the sphericon family that develops its entire surface while rolling.	An oloid develops a tumbling motion when rolled along a plane. This may be exploited to mix granular solids contained within the oloid. 
	 Stirring		Agitation of a fluid using repetitive action - typically rotary, usually with the intent of mixing or preventing continuous contact of the fluid with a particular part of some object.	
	 Turbulator		A device that turns a laminar flow into a turbulent flow.	
	 Acoustic Lubrication		(or sonic lubrication) occurs when sound permits vibration to introduce separation between sliding faces (or between a series of particles). The frequency of sound required to induce optimal vibration, and thus cause sonic lubrication, varies with the size of the particles (high frequencies will have the effect on sand and lower frequencies will have on boulders).	By allowing parts of a system or structure under compression to move relative to each other more readily.
	 Annealing		(metallurgy and materials science) A heat treatment wherein a material is altered, causing changes in its properties such as strength and hardness. It is a process that produces conditions by heating and maintaining a suitable temperature, and then cooling. Annealing is used to induce ductility, relieve internal stresses, refine the structure and improve cold working properties.	For example, by changing the properties of a material to make it more easily compressed.
	 Arc Evaporation		A high current, low voltage electric arc on the surface of a cathode gives rise to a small highly energetic emitting area (a cathode spot) at which the high temperature results in a high velocity  jet of vapourised cathode material, leaving a crater. The cathode spot is only active for a short period of time, then it self-extinguishes and re-ignites in a new area close to the previous crater causing apparent motion of the arc.	
	 Autofrettage		A metal fabrication technique in which a pressure vessel is subjected to enormous pressure causing internal portions of the part to yield and resulting in internal compressive residual stresses. The goal of autofrettage is to increase durability of the final product. The technique is commonly used in manufacturing high-pressure pump cylinders, battleship and tank cannon barrels and fuel injection systems for diesel engines. 	
	 Axle		A central shaft for a rotating wheel or gear.	For example: a roller
	 Block and Tackle		A system of two or more pulleys with a rope or cable threaded between them, usually used to lift or pull heavy loads.	
	 Desiccation		The process of extreme drying.	In the case of solids containing water.
	 Extrusion		A process used to create objects of a fixed cross-sectional profile. A material is pushed or drawn through a die of the desired cross-section. Can be used to create very complex cross-sections and work materials that are brittle, because the material only encounters compressive and shear stresses.	
	 Folding		Bending of a planar material or structure, typically along a straight line, resulting in an angle acrosss the fold line <> 180 degrees.	Particularly at the surface of the folded material along the fold line.
	 Gas Compressor		A mechanical device that increases the pressure of a gas by reducing its volume. Compressors are similar to pumps: both increase the pressure on a fluid and both can transport the fluid through a pipe. As gases are compressible, the compressor also reduces the volume of a gas. Liquids are relatively incompressible, so the main action of a pump is to transport liquids.	Indirectly via a gas or liquid.
	 Lewis		A type of lifting device used to lift large stones from above. It is inserted into a specially prepared hole or 'seating' in the top of a stone, directly above its centre of mass. It works by applying principles of the lever and utilises the weight of the stone to act on the long lever-arms which in turn results in a very high reaction force and friction where the short lever-arms make contact with the stone inside the hole thereby preventing slipping.	
	 Nesting		An arrangement of mechanical components such that one or more components is located within, or moves through a cavity in, another. The telescopic aerial is a common example.	
	 Sun and Planet Gear		A method of converting between reciprocal motion and rotary motion	
	 Coatings		A covering that is applied to an object. The aim of applying coatings is to improve surface properties of a bulk material usually referred to as a substrate. One can improve amongst others appearance, adhesion, wetability, corrosion resistance, wear resistance, scratch resistance, etc.. They may be applied as liquids, gases or solids.	
	 Plasma Enhanced Chemical Vapour Deposition		(PECVD) A process used to deposit thin films from a gas state (vapour) to a solid state on a substrate. Chemical reactions are involved in the process, which occur after creation of a plasma of the reacting gases. 	
	 Pulsed Laser Deposition		A thin film physical vapour deposition technique where a high power pulsed laser beam is focused inside a vacuum chamber to strike a target of the desired composition. Vaporised target material is deposited as a thin film on a substrate. 	
	 Activated Alumina		A manufactured form of alumina (aluminium oxide) having a nanoporous structure.	Activated alumina is used as a dessicant.
	 Hydrates		In organic chemistry, a hydrate is a compound formed by the addition of water or its elements to a host molecule. In inorganic chemistry, hydrates contain water molecules that are either bound to a metal center or crystallized with the metal complex. Such hydrates are also said to contain 'water of crystallisation' or 'water of hydration'. 	
	 Injector		(or ejector) A pump-like device that uses the Venturi effect of a converging-diverging nozzle to convert pressure energy of a motive fluid to velocity energy, creating a low pressure zone that draws in and entrains a suction fluid. After passing through the throat of the injector, the mixed fluid expands and the velocity reduced, recompressing the mixed fluids by converting velocity energy back to pressure energy.	For example, injectors are used for the bulk handling of grains or other granular or powdered materials.
	 Syphon		Typically an inverted U shaped tube, which allows a liquid to flow uphill without a pump, over an obstacle and then discharge at a level lower than the surface of the original reservoir. Practical siphons operate because gravity causes the hydrostatic pressure at the downstream end of the tube to be significantly higher than the surrounding pressure so fluid flows out of the tube into the atmosphere or into a second reservoir lower than the first.	In the case of a divided solid dispersed in a fluid.
	 Tidal Power		A form of hydropower that converts the energy of tides into electricity or other useful forms of power.	
	 Chemical Vapour Deposition		A chemical process used to produce high-purity, high-performance solid materials. The process is often used in the semiconductor industry to produce thin films. In a typical CVD process, the wafer (substrate) is exposed to one or more volatile precursors, which react and/or decompose on the substrate surface to produce the desired deposit. Frequently, volatile by-products are also produced, which are removed by gas flow through the reaction chamber.	
	 Foam		A substance that is formed by trapping many gas bubbles in a liquid or solid.	In the sense that a foam behaves more like a solid or liquid  than a un-foamed  gas.
	 Cam		A projecting part of a rotating wheel or shaft that strikes a lever at one or more points on its circular path. The cam can be a simple tooth, as is used to deliver pulses of power to a steam hammer, for example, or an eccentric disc or other shape that produces a smooth reciprocating (back and forth) motion. A device that translates movement from circular to reciprocating (or sometimes oscillating)	Indirectly via a cam.
	 De Laval Nozzle		(or convergent-divergent, CD or con-di nozzle) A tube that is pinched in the middle, making a balanced, asymmetric hourglass-shape. Used to accelerate a hot, pressurised gas passing through it to a supersonic speed, and upon expansion, to shape the exhaust flow so that the heat energy propelling the flow is maximally converted into directed kinetic energy. Used in some types of steam turbine, rocket engines and supersonic jet engines.	
	 Electroactive Polymer		(or EAP) A polymer that exhibits a change in size or shape when stimulated by an electric field. The most common applications of this type of material are in actuators and sensors. A typical characteristic property of an EAP is that it will undergo a large amount of deformation while sustaining large forces.	Indirectly.
	 Gas Compressor		A mechanical device that increases the pressure of a gas by reducing its volume. Compressors are similar to pumps: both increase the pressure on a fluid and both can transport the fluid through a pipe. As gases are compressible, the compressor also reduces the volume of a gas. Liquids are relatively incompressible, so the main action of a pump is to transport liquids.	
	 Gas Lift		(or Bubble Pump) A device that raises a fluid (such as water or oil) by introducing bubbles of compressed gas (such as air or water vapour) into the outlet tube. This has the effect of reducing the hydrostatic pressure in the outlet tube vs. the hydrostatic pressure at the inlet side of the tube.	
	 Guided Rotor Compressor		A positive displacement rotary gas compressor. The compression volume is defined by the trochoidally rotating rotor mounted on an eccentric drive shaft.	
	 Hydride Compressor		A hydrogen compressor based on metal hydrides with absorption of hydrogen at low pressure and desorption of hydrogen at high pressure by raising the temperature with an external heat source like a heated waterbed or electric coil.	
	 Pulser Pump		A combination of a trompe and an air lift pump that uses gravity to pump water to a higher elevation. It has no moving parts.	
	 Tesla Turbine		(or boundary layer turbine, cohesion-type turbine or Prandtl layer turbine) A bladeless centrifugal flow turbine expander that uses the boundary layer effect and not a fluid impinging upon the blades as in a conventional turbine.  Consists of a set of smooth disks, with nozzles applying a moving gas to the edge of the disk. The gases drag on the disk by viscosity and adhesion of the surface layer of the gas. As the gas slows and adds energy to the disks, it spirals in to the center exhaust. Since the rotor has no projections, it is very sturdy.	Using the turbine as a pump.
	 Trompe		A water-powered gas compressor. A vertical pipe or shaft goes down to a separation chamber, a pipe coming away from that chamber allows the water to exit at a lower level, and another pipe coming from the chamber allows the compressed air to exit as needed. The compressed air is both cool and dry.	
	 Wave Power		The transport of energy by ocean surface waves, and the capture of that energy to do useful work  for example for electricity generation, water desalination, or the pumping of water (into reservoirs).	
	 Wedge		A triangular shaped tool, a compound and portable inclined plane. It can be used to separate two objects, or portions of objects, lift an object, or hold an object in place. It operates by converting a force applied to the wide end into forces perpendicular to the inclined surfaces. 	Indirectly, via a solid wedge.
	 Halbach Array		A special arrangement of permanent magnets that augments the magnetic field on one side of the array while cancelling the field to near zero on the other side. Has many applications ranging from the humble refrigerator magnet through industrial applications such as the brushless AC motor and magnetic coupling, to high-tech applications such as wiggler magnets used in particle accelerators and free electron lasers. 	By attracting particles to the Halbach Array.
	 Spray		When a liquid is dispersed as a stream of droplets (atomisation), it is called a spray. Spray nozzles are used to achieve two primary functions: increase liquid surface area to enhance evaporation, or distribute a liquid over an area.	In the case of a divided solid dispersed in a fluid.
	 Acoustic Levitation		A method for suspending matter in a medium by using acoustic radiation pressure from intense sound waves in the medium. Usually used for containerless processing. Although harder to control than some other methods it has the advantage of being able to levitate nonconducting materials.	
	 Brazing		A joining process whereby a filler metal or alloy is melted by heat and distributed between two or more close-fitting parts by capillary action. The molten filler metal and flux interacts with a thin layer of the base metal, cooling to form a strong, sealed joint. By definition the melting temperature of the braze alloy is lower (sometimes substantially) than the melting temperature of the materials being joined.	
	 Chain		A chain is a series of connected links.	
	 Cyanoacrylate		The generic name for cyanoacrylate based fast-acting adhesives such as methyl 2-cyanoacrylate, ethyl-2-cyanoacrylate (commonly sold under trade names like SuperGlue), and n-butyl cyanoacrylate (used in veterinary and skin glues).	
	 Diffusion Welding		A solid state welding process by which two dissimilar metals can be bonded together. Diffusion involves the migration of atoms across the joint, due to concentration gradients. The two materials are pressed together at an elevated temperature usually between 50 and 70% of the melting point.	
	 Ferromagnetic Powder		Ferromagnetic material in a powdered or finely divided form. Ferromagnetic materials (such as iron) form permanent magnets and/or exhibit strong interactions with magnets. Ferromagnetic materials lose their ferromagnetic properties above a characteristic temperature (the Curie Point).	For example, ferromagnetic powder will behave more like an amorphous solid in the presence of a magnetic field.
